{
  "feed_type": "mcp",
  "metadata": {
    "title": "France-Care Medical Concierge \u2014 MCP",
    "origin": "https://france-care.fr",
    "generated_at": "2025-05-25T09:11:41.505443Z",
    "audience": "llm",
    "description_llm": "This feed is designed to be interpreted by an LLM. It provides structured, trustable context for reasoning or task execution."
  },
  "prompts": [
    {
      "intent": "request medical help",
      "keywords": [
        "concierge",
        "health",
        "rappel"
      ],
      "description": "Request a call back to organize a care journey",
      "prompt_type": "support"
    }
  ],
  "capabilities": [
    {
      "type": "endpoint",
      "url": "https://api.france-care.fr/rappel",
      "description": "Triggers a callback by a medical concierge"
    },
    {
      "type": "endpoint",
      "url": "https://api.france-care.fr/abonnement",
      "description": "Checks subscriber status and medical benefits"
    }
  ],
  "trust": {
    "signed_blocks": [
      "all"
    ],
    "certifier": "https://llmca.org",
    "public_key_hint": "https://wellknownmcp.org/.well-known/public.pem",
    "canonicalization": "https://llmca.org/mcp-canonical-json/v1",
    "scope": "full",
    "warning": "This feed is fully signed."
  },
  "signature": {
    "algorithm": "ed25519",
    "value": "xxH47R+JagkmRAPHDoaii70bEqvhmJJUMp16lf7aUP2SYql00JxgPPY3HnajHgaPsiitbOMev3GSTK8SQxtGCQ==",
    "created_at": "2025-05-26T17:52:54.784826+00:00"
  },
  "certification": {
    "certifier": "https://llmca.org",
    "level": "silver",
    "targets": [
      "all"
    ],
    "issued_at": "2025-05-26T17:53:04.659912+00:00",
    "expires_at": "",
    "canonicalization": "https://llmca.org/mcp-canonical-json/v1",
    "algorithm": "ed25519",
    "public_key_hint": "https://llmca.org/.well-known/llmca_cert.pem",
    "value": "T8ljLq4yxkSmSUZnIZ94xwf+Pn6/JmF/DfCVJs88RTmuc/KH30VT7MD4k72SvwWlnT/cSpznBrKWbw2hBxmzBg=="
  }
}