{
  "feed_type": "example",
  "metadata": {
    "origin": "https://wellknownmcp.org/exports/demo/kungfu.llmfeed.json",
    "title": "Kung Fu Mode Activated",
    "description": "Playful demo feed. Shows how a minimal llmfeed.json works with signature and certification.",
    "tags": [
      "fun",
      "demo",
      "mcp",
      "agent",
      "matrix"
    ],
    "lang": "en",
    "publisher": "wellknownmcp.org"
  },
  "trust": {
    "block_name": "trust disclaimer",
    "scope": "none",
    "warning": "This feed is not signed."
  },
  "data": [
    {
      "type": "quote",
      "from": "Neo",
      "content": "Now I know kung fu."
    },
    {
      "type": "summary",
      "content": "Minimal example of a valid llmfeed.json. Contains a single quote and signature blocks. Useful as template for developers."
    }
  ]
}