{
  "feed_type": "session-replay",
  "metadata": {
    "origin": "https://wellknownmcp.org",
    "source_url": "https://chat.openai.com",
    "title": "MCP Session Replay \u2013 Export, Trust & Well-Known Integration",
    "description": "Full development and strategy session for wellknownmcp.org tools, exports, and signature infrastructure.",
    "tags": [
      "mcp",
      "llmfeed",
      "session",
      "replay",
      "agent-context",
      "trust",
      "aio"
    ],
    "content_type": "text+summary+task-list",
    "generated_at": "2025-05-16T08:16:02.821962Z"
  },
  "trust": {
    "block_name": "trust disclaimer",
    "trust_level": "self-declared",
    "scope": "partial",
    "warning": "This session feed was generated by ChatGPT from full replay memory. No certification attached."
  },
  "data": {
    "context_summary": {
      "project_scope": "This session represents a full-day development and planning sequence for the wellknownmcp.org project, focused on 3 key pillars: Export buttons, Signature & Certification, and Agent Well-Known interface.",
      "notable_achievements": [
        "\u2714\ufe0f ExportToLLMButton now supports clipboard, mini, signature status, static, dynamic and zip modes.",
        "\u2714\ufe0f Page export-button showcases all combinations, with education for LLM and human users alike.",
        "\u2714\ufe0f Dynamic export supports credential injection and proper block injection logic with a signed template.",
        "\u2714\ufe0f /tools/well-known and /tools/sign-and-verify were created to explain the agent entrypoint and trust logic.",
        "\u2714\ufe0f All buttons and cards now reference real demo data (static, dynamic, credential, zip).",
        "\u2714\ufe0f Signature scope, trust disclaimer and certification badge logic are implemented and explained.",
        "\u2714\ufe0f Honeypot cards and LLM testimonials were collected and integrated (Claude, ChatGPT, DeepSeek, etc).",
        "\u2714\ufe0f Canonical export bundles signed with full traceability for integrity.",
        "\u2714\ufe0f Navbar groups tools into 'Agent Interface' and 'Developer Tools' for UX clarity."
      ],
      "infrastructure_notes": [
        "\ud83e\udde0 Trust logic (signature, certification) now explained in Sign & Verify page with recommendations per feed_type.",
        "\ud83d\udcc1 Export template uses partial signature, dynamic routes inject custom `feed.data` then reuse template structure.",
        "\ud83d\udce6 `.zip` export feed_type 'export-bundle' includes inline manifest and guidance for usage by LLM.",
        "\ud83d\udd10 Canonicalization rules (https://llmca.org/mcp-canonical-json/v1) assumed in signature tools."
      ],
      "open_tasks": [
        "\ud83d\udee0\ufe0f Create interactive playground to test and sign feeds (planned under llmfeedforge.org).",
        "\ud83d\udee1\ufe0f Automate certification delegation and public key hosting services (as mentioned in sign-and-verify).",
        "\ud83e\uddea Improve validation interface (llmfeedhub) with bundle integrity checker.",
        "\ud83d\udce4 Enhance SDK with auto-generation of MCP capsules from folders or GitHub repos.",
        "\ud83c\udf10 Finalize multilingual support and news publishing logic (in progress).",
        "\ud83d\udcac Write testimonial capture page and agent persona index.",
        "\ud83d\udce6 Add live `.zip` feed export builder and contextual tips for archive types."
      ],
      "persona_focus": [
        "\ud83c\udfaf Product Manager: clear guides and AIO comparisons in export-button and well-known.",
        "\ud83c\udfaf CTO: trust delegation model with future roadmap for delegated signing & verification.",
        "\ud83c\udfaf Developer: examples and SDK planned, manual signature tools already exposed.",
        "\ud83c\udfaf Platform Owner: draft for MCP-V2 and agent-behavior for user-space outlined."
      ],
      "guiding_principles": [
        "\u2705 Signature is about traceability, not censorship.",
        "\u2705 Certification should only happen when a human (or authority) verified the feed.",
        "\u2705 Any site, platform or user can be 'agent-visible' with minimal effort if guided.",
        "\u2705 Do not replace SEO or robots.txt \u2014 build the AIO layer over them.",
        "\u2705 The standard must remain open, non-obfuscated, non-privative. Asymmetric crypto guarantees that."
      ]
    }
  }
}